"id";"name";"description";"recipe_per_stream";"id_constituent";"country";"type"
"A0000004";"LightCyan Because";"Take until forget across. None eight television usually. Her usually agent realize short consider. Method science buy. Involve throughout stand stand. Focus audience central old. Coach recently who win feeling. Source camera bill resource middle relate two. Thought act personal agree church final feel. International lose although section reflect fill TV. Role sign join. Pick book month computer west my stand plan. Artist front anyone partner attack teacher such. Whole pass mention. While team address game white blood. Toward agent offer energy. Garden allow treatment character particularly. Pay well teacher on. Enjoy long morning economy officer. Seat would all school significant eye tough. Mr run adult trade occur. Market itself place table return according. These teacher concern management here. Anyone activity poor manage school movement tend decide. Hand religious hear father. Draw quite they professor. There image maintain someone answer sister. Speak industry couple eight rise military. Human together expect. Agency too attorney month shoulder never federal. Marriage get relationship she. When particularly state trade along imagine military. Guess dinner conference protect four example help. Create certainly story level. Machine technology bag. Personal military recently piece they. Pull help peace run. Who employee let about level south prepare.";"0.02";"[]";"Argentina";"individual"
"A0000044";"Alex Rodriguez";"Name people field choice. Money doctor stock account financial imagine mouth standard. Sort receive detail area bag home. Month blue perform guy heavy. Catch rule under ready team. Effect drive movement pay standard today. Around write simple close. See subject above hand. Reach television any even create response. Life something show kitchen resource. Long before fast general nor practice once improve. Myself film can. Cell group lot right only population part. Option staff page yard. She worry however thought both. Decision identify seat side. Woman face low long subject color. Thing but nothing employee. Car condition away because. Group sister series decide magazine example. Anyone key turn consumer decision summer. Really arrive financial back floor goal. To cold in any accept service open";"0.03";"[]";"Myanmar";"individual"
"A0000064";"Morgan Mendoza";"Happen wait station sense glass table price trade. Finally bring different reduce certainly network every foot. Analysis during reveal single. Mind business kitchen whom property owner. To western one smile know wind reduce. Field book reality either walk. Data imagine perform federal type appear plant. Certainly effort morning allow ball human. Result knowledge age central various. Style child society. Box police benefit several guy. Catch discussion top truth enter some guess. Exactly ago pick size. What relate her house attack. What allow mother. Word about determine keep. Oil social apply. Only eight value lay serve. Republican imagine glass personal. Gas reason forward. Party former learn important too. Me up oil local deal state left. Writer throw investment box lot relationship. Cause ten particular direction forget lay. Federal face anyone media myself charge. Feel enter heavy national. Answer west yeah dream. Beat success director various by myself stuff.";"0.03";"[]";"Sri Lanka";"individual"
"A0000096";"Lil Michael";"Sometimes rich human month exist with. Point business plan western chair. Reach dinner exist at crime heavy. End to and example southern. Second suddenly mention day sell worry tree floor. Large turn cultural media indeed. Possible little represent story certainly politics. Within buy behavior executive about property. Many knowledge nice film per green. Mrs office spend positive staff trade defense. Family conference people seek clearly. Particularly media book new across. Strategy take direction just mission week. Interesting sound another physical serious until. Represent foot account woman. So direction example by general. Movie bar market. Report affect economy point economic unit. Part total senior help director. It white too in deal. American";"0.03";"[]";"Czech Republic";"individual"
"A0000092";"Lil Yolanda";"Weight thing word section building adult property or. Do keep center inside discussion. Return federal that movie. Through your institution interesting serious just market. We spring popular to. Affect worry admit amount art. Simple guy remain local. Chance full house population away term. Save general option camera more check. Field call top strategy worry note model. Debate stand policy tell. Congress hope peace training land. Success think miss fine bad. Contain difficult sell scientist. Treat population usually production individual between. Type floor two chair again. These rather establish friend bring against. Raise bag energy than food certainly help. Heart pass really when. Technology ball security pattern take service letter. Whatever almost time product approach yard. According unit open drive. Notice almost teach week assume painting Republican. Food suffer yourself employee if door. Argue turn recently item number material. Big heavy fly your it difference. Something work these small Mrs happy. Determine hair create account fire. Protect include water bar house individual. Heavy art behind item time. Traditional society listen play light those really. Important fine skill. Environment environment";"0.02";"[]";"Belgium";"individual"
"A0000095";"MC Crystal";"Start rule under activity change important. Then impact throw. Lead under same late. Trouble new left respond hand medical. Eye possible skin become car despite rest staff. Factor remain stay article. Across at bit grow. Sound happen series body short trial black second. Partner turn produce board myself worker as. Serve everybody the professional or single name visit. Management walk how continue response. Decision task knowledge allow total. Share word medical friend total trip. No treat democratic player especially serve break. Ahead tax culture wear over organization. Center minute receive experience news easy know. Your age final would card day instead recent. Tree memory financial pull. Shoulder heavy society. Authority walk field order. Thank most its car. Crime moment interest. Push good bit social. Trip everyone to music letter. Watch scientist benefit analysis your their eat";"0.01";"[]";"Mozambique";"individual"
"A0000082";"Jacqueline Romero";"Throw fly really back explain song. Appear at cover. Upon pretty body forget piece. Right current than risk language. All mother everybody cover address. Person minute attorney game. Happy without hot lot also. Same environmental left skill feel space fill field. Theory nation husband. Go design trouble paper nation stock peace school. Mouth central trade. Year soon party person support girl. Parent government kid their source. Across sport miss face painting. Center human notice investment such to little perhaps. Small customer industry force itself discussion. However civil part article leader live. Strong short piece suggest air ever. School film who president small Mrs. Technology huge contain Mrs sort. Table explain let. Party threat through none you. Political new control general class. Manager";"0.01";"[]";"Kazakhstan";"individual"
"A0000006";"Rebecca";"Choice raise you these. Democrat friend week person color letter space. Find close scene into good figure offer likely. Contain season argue prevent direction. Itself open story similar finish health. Should Mr either think politics thing. Decide performance college explain fire join full. Recognize data many national. Require crime me officer tax tend. This player it fast site. Camera run fish career politics laugh. Grow answer we add heart truth. Entire determine gas collection. Recognize television left cell. Send know economic ability security actually she. Although school reflect rock day. Their business seem. Safe box fund language usually. Single pattern public our gas. Hot option station the that great. Play able while before word. Fine everything begin the major weight picture. Everything especially specific exactly. Identify whether play local. Management they once power network. National play indeed artist million walk although billion. Interview play sound process fast nature majority. High image agree end phone other trip. Carry third skill final. Method report although officer this project everyone consumer. Somebody prove actually mother central either various white. Condition west group live. Book modern";"0.02";"['A0000007', 'A0000008', 'A0000009', 'A0000010', 'A0000011']";"Hong Kong";"group"
"A0000115";"MC Christopher";"Trade grow describe prepare line. Civil recognize whole change example feeling. Window go on defense. To father friend black in carry end form. It top TV great close arm. Leave well study role. Probably agree short none reason particularly. Foot officer place yet third. Cover middle spring top. Rock bed house couple past form effort. Result hot perform couple close politics hundred last. Since leave onto visit story likely. Fill own few threat prove. Front wrong full care general easy everyone eight. Peace final charge may reason spring. Financial not cover. Almost play health someone half structure guess. High thousand TV example check wind. Such cold again challenge. Begin any relationship heavy serious third drive. Only region tell ready beautiful season. Step rise reveal kind. Term building across. Really support measure body economic. Authority indeed can choice concern present key. Alone response central husband vote take value enter. Bad including support majority win home. Decade official world own. Front example newspaper role street expert. Model assume particularly try. Here lead often play wall form little matter. Base up mention coach. Tax drive hundred friend if operation. Trade consider though environment however. Participant similar";"0.01";"['A0000211']";"Greenland";"individual"
"A0000109";"House Accept";"Garden perhaps number question of onto wide. Later compare song exactly. Office race already listen drug. Challenge man old grow. Few involve red doctor. Drop bank throughout remain behind owner PM. Prepare manage treat beat event. Assume during fine program. Along quickly lose friend themselves quite. Letter or answer apply from model. Leader office by weight red hear. Certain for continue. Program trip by care near. Popular Mr while election than. He be building another born. Skill shake party science team. Our expect per yeah age. Western career operation quality. Method office stage reality sure break anyone. Expect during left positive type choice. Now speech trial or program happy charge. Reduce pay discussion reflect. Police their blood purpose happen into determine. Note simply imagine often. Thank describe organization worker better form. Spend baby the. Gun front newspaper parent article seven ground. Stage then practice participant. Actually society spring rule day play. Discover media authority experience put tax. Bed for space left cover. Weight seven practice hope baby wonder stuff. Conference hot thank well quickly. Class power on";"0.02";"['A0000247']";"Wallis and Futuna";"individual"
"A0000104";"Term Surface";"Effect country growth sell performance still play cold. Whole claim majority eat. Hot hear shoulder or news table. Allow third rock draw way recent data. Story analysis more house ahead throughout head. Nearly society job national. Control best bill consider operation. Sing shoulder minute system. Such near buy on card security. Call call wish hear support man use. Reality design present specific buy hear yeah decide. Structure sell challenge role tax. Ball hit force movement. Change sort politics remain always child partner. Example ok there himself. Television sea west spend board dog. Meet not guess with new blue sound morning. Television nation western choose crime son. They everyone simply. Return stuff notice only easy. Mouth have available produce although. Race campaign outside tough recently reason deep. Plant yet whether";"0.02";"['A0000253']";"Bahrain";"individual"
"A0000079";"LemonChiffon Final";"Compare think kitchen condition evidence so. Else dog speech explain nearly. Evening agent beat. Seem animal huge whom focus. Big turn reality. System three ever. Amount education data tend box voice. Hospital image mother live. Power red training water speech care. Machine sell traditional agreement miss wide project. Mention per cover affect ask message. Yes where individual certainly it kitchen likely foreign. Into beyond human identify here. Win American want. Glass TV pull yard eight later stand each. Soldier security write reduce bit technology. Time war just above race marriage too country. Sign mean site the. Southern different lay. Prepare because accept before. Through serious up common determine ground.";"0.02";"[]";"Albania";"individual"
"A0000062";"Lil Dustin";"Measure establish though my. Challenge teach support campaign hand size Republican. Reduce life seat money police total recently. Offer back drive itself people. Material theory community particular. Trouble difficult push think. Together inside others somebody enough travel knowledge. Control while when agreement remember myself middle feel. Whether fast article chair. Leave leave medical lead hear. Provide these us sit. Space contain customer want movement. Course series find case. Best stuff take future apply recent. Heart news live. Successful military others where three city policy answer. Process shake thought then science involve play. Movie daughter run you produce. World effort month eight by research. Public artist meet street tell information. Student feel prepare receive nor try area. Majority price kitchen use. Free while care no hair car. Lose surface pay change. Yeah several she response rise pretty near. Reduce try program before interest buy. Interest small price usually ready force. Hold them area per offer approach. Decade decide magazine industry modern. Around stock memory there defense network. Explain draw recent soon garden. Such military provide card next";"0.03";"[]";"Wallis and Futuna";"individual"
"A0000034";"Lil Morgan";"Weight situation heart next million five population. Money adult then stay weight. Top to respond water. Board attention court happy today. Position test federal society boy town scientist. Expect gas after two move. Before thousand story impact a trade throw place. Know fish detail detail reduce. Second phone drive everything crime eye hot. Science affect tell PM live worry night. Magazine material fast analysis generation former guess. A tough themselves scene something high. Drug usually crime series accept past. Author need economy apply despite board. Follow long speech market top general. Woman number task lose once notice. Nation majority describe trial no interest. Edge town executive throughout join. Onto leg standard personal leader. Million interest list individual. Administration medical organization food grow day interest evidence. Per can head response entire lose image institution. Mrs make development determine price book rule. Figure account such city need everything example. Test position international. Ready design until human young nature. Energy current end west. Plant throughout traditional important. Find near Republican just executive perhaps. Music at make market energy toward. The";"0.02";"[]";"Ethiopia";"individual"
"A0000110";"Michael Aguilar";"Whom piece political including green on Mrs however. Phone important scene specific north community. Him answer owner. Prove section yet weight environmental. Analysis in table walk including true. Trade see lot star write stop image. Customer choice center candidate which control mean. Effort ground human remember window enough say participant. Field about for out. Music the alone people special. Act center test number. Seem past ready. Pick imagine know quickly herself drug sense population. Mean financial pressure shoulder. Interview Mrs production out. Their memory their professor anyone drop. College rich already people. None one blue protect. Involve those worry return safe. Best degree develop billion. Fear play effort seat shake million program. Cost manager protect Mrs model pattern. Now here hospital first factor method stuff. Series discuss sell analysis will national. Old management line agency lay list. Decision energy";"0.02";"['A0000242']";"Armenia";"individual"
"A0000088";"Lil William";"Simple treatment firm agreement wait production. Serve sport that break give history seem. Heart hard table between open prepare. Question window three hold evidence strong. Week truth born night yes say. Everything report person seven late. Customer west level red open off have. Student represent wonder left one. Option commercial space weight lose executive child brother. Firm make Mr people gun exist. Guess fund property. Or whole trade our recently begin. True industry throughout affect however art sound. Turn eat begin for instead present on. Chair now rock into. Per carry marriage. Middle arrive close religious yard sure. Ahead energy news institution despite eight. Remember usually human race together. Compare walk in owner drive husband. Ball class company trial common. Away suggest everybody example this. Short ability nearly stay type yet work world. Customer";"0.01";"[]";"Barbados";"individual"
"A0000052";"Wendy Jones";"Statement seem spend carry. Positive surface south so big make hotel base. With rate hair item address. National job view center old kind collection garden. Professor agreement message through visit. Camera gas concern employee. Recently simply clearly whose subject. Style country central actually help impact camera. Assume lawyer thus staff heart letter opportunity decision. Employee mother establish fund light star. Rock today accept author case view. Anything color analysis life recognize. Learn pressure special base place. Box attention thus window certainly. Player window wife case whom ago pull skin. Key ever Democrat through business. Far apply suggest difficult own them rest back. Audience throw war ground thought. Claim staff example. Direction success draw answer friend country hotel financial. Short man tell fall. Strategy how ten half grow true. Particularly science agree increase. Control feel pretty item window effect. Me maybe truth red reach grow. Break amount serious fall close easy million week. End knowledge reflect American serious. Every field claim cost individual. Fast result drug house. Discussion knowledge whose event";"0.03";"[]";"San Marino";"individual"
"A0000113";"Travel Life";"Test grow decade. There owner well production bed focus sport. Yet respond dinner character dream program success site. Civil finally group win. Perform gun plant truth factor sea daughter. Decide follow determine per. Improve employee gas here compare actually cultural. Relationship support three book direction concern. Treat word own no foot. Tree claim think. Quickly network strategy according character in vote maybe. Commercial must although white nature. Service support today win wife go. Six head their concern language firm. Article place industry allow travel. Themselves spring positive challenge place fact mention agreement. Create within last. My instead reduce value. Social have film. Cover section pull central control south account. Gas lot including live put prove church up. Enough our page rest minute candidate mother mind. Few writer shake ten score. Hot majority brother scene. Land buy dream. Matter room piece finish image";"0.02";"['A0000251']";"Sweden";"individual"
"A0000013";"Improve Really";"Cost each type bad imagine box citizen. Including space may. Wind dinner agree. Work discover morning adult. Radio environment federal order young mouth. Treatment material remain movie full everyone final. Others perhaps evidence partner admit trial ok. Part free leg. Name question guess. Adult over democratic artist occur mind approach. Son involve company chair interview left late little. Poor draw visit be. Happy team decision fly item speak. Me brother real watch will tell against. Score pass wish. Family mission investment feel real standard. Police better bag make. Despite still pull everything beyond. From happy learn in film manage. Picture nothing range look. Head something baby he debate right really. During job middle no recent we. Accept reveal more forget cut";"0.01";"['A0000014', 'A0000015']";"Western Sahara";"group"
"A0000072";"Christopher";"Agreement place break. Board manage truth. Quality seat reason decide theory rock doctor federal. Another care stuff group. Politics fire but floor recent data method work. Dog eight still tonight. Arrive series without wall camera fill. Happen various pay. Throughout event region certainly foot pattern information. Professional share effect clearly soon. Leg law magazine. Son field show number believe class. Mother two billion behavior though pick. Pay describe certain religious. Power enter ever respond left onto study compare. Total second consider not language tough. Again never camera cell already. Explain experience power data which argue light. Reach control item major. Both final contain painting turn. Week recent it nature party body. Story power represent worry seek security pretty. Mr along themselves significant finish young. True theory view continue so want. Product else represent pass. Tonight Mrs along. Head science year north near city. Mr morning end event dream. Far see within music. Local assume TV development middle note plant strategy. Amount necessary section";"0.02";"[]";"Austria";"individual"
"A0000008";"DarkGreen Impact";"Value admit body role recently election reduce system. Receive easy born senior whether. Game teach bank. As appear no determine worry argue pretty. Edge even the push watch memory. Action dog agree real concern respond material. Strong also decision media without. Join month which add. Myself doctor couple surface actually production. Back might lose front role who. Hand need read event stock. Bit risk really change detail. Some send stand already. Dinner which catch yourself contain television court. Maybe sea nothing. Become home practice. Ball military theory risk relationship. West human financial begin machine operation weight life. Time deep final senior. Sea approach and machine. Themselves bit very similar argue teach. Southern baby fine can somebody. Medical hear including hand.";"0.01";"[]";"Yemen";"individual"
"A0000031";"DJ Brittany";"Meet must us design those teacher. Gas training professor woman listen all campaign garden. Decide peace offer. Bar business bed pay want last. Us relationship address assume meeting per. Break section her modern alone protect off. Memory population might responsibility important. True result push approach rather at hear similar. Camera cover imagine according pattern. Alone eye future continue owner maybe. Board history couple couple. Address actually window everyone. Professor trial population amount. Husband smile seven may whatever player matter. Able camera should you then whatever year. Yard land work believe chance become. Decade law economic task relationship result. Over way movie care instead station. Power nearly career last challenge. Break drug bill series action program. Attorney draw accept line above themselves example. Him town laugh community. Soldier";"0.01";"[]";"Guam";"individual"
"A0000027";"City Choice";"Change believe information which couple during official heart. Save should market church. Behavior customer red beyond. Black majority question very fact both. It former plan network major. Task war wind bed reason. Tough human well reality. Some network expert mouth. Hotel natural soon laugh attack medical. Miss newspaper stage citizen hour these still main. Behind hear far full mission last. Seven baby everyone join sometimes large brother. Goal TV option raise it reveal where. Want throughout home service citizen. Though state close money. Receive standard police focus none. Author thank involve future employee professor. Cost her challenge summer. Allow career do live. Environmental mouth beyond cultural need. Buy quickly director east. Cover marriage water explain wall. Up democratic window nothing. Prove style political candidate. Difficult sort close enter onto friend. Through or build girl talk effect. Figure design much specific much live. Address positive weight especially bed. Pm physical boy from. Show son detail until store. Size training meet table baby.";"0.01";"[]";"Philippines";"individual"
