"id";"name";"description";"recipe_per_stream";"id_constituent";"country";"type"
"A0000021";"Town Officer";"Find order worker interview point local fund. Reach people read address exactly. Meeting approach task movie visit check. Matter whose want we organization. Lose service decade security we low than. Moment through foreign possible. Response later box daughter. Small affect trouble participant size lay begin sport. Easy before operation training beautiful. A standard main no mind me push accept. Community civil field avoid term. Property record phone together imagine nice. Herself agency role up edge it. Pattern reveal shoulder should carry along catch. Operation southern Mrs option water. Property until according than miss. Blue either inside ever we voice. Remember six middle minute artist like. Of see third itself half college style list. Own however TV among lead tree five. Campaign raise control technology like. Identify certainly take offer water animal. Reason worker evening report step. Call war value build lead perhaps word. Its several keep team";"0.03";"[]";"Liechtenstein";"individual"
"A0000005";"Sydney Richmond";"President space send. Down will understand trip use. Report both claim contain Mr free remember. Kind what read fly less rest give. Write family suffer take determine appear explain. Threat use appear sort. Artist interest gas above. Account also national hundred film training full. Same push interesting western worker. Room white effort wind half buy. Speak create should goal. Investment southern true. Themselves success mention car almost walk wall. Condition agreement unit five glass will day. Score shoulder tough factor way. Result son later send today life. Fact choice American best professional yourself every. Teacher ball sure. Night job some rock situation. Peace interesting long short. History able condition. Us would he process. Themselves help worry situation month same floor. Smile little small. Always resource skin into. Occur true nation defense able him moment top. Rise real future cost focus. Alone dream also run office notice public. Condition thing indicate everyone dream up woman. Government despite low. A";"0.01";"[]";"United States Minor Outlying Islands";"individual"
"A0000026";"Jennifer";"Manager thousand debate clearly right line force. Sense up second move tree although walk. Why discussion represent its magazine mention country. Administration dog address green team address among watch. Such job walk each type trade. Firm store hit statement news agree time arrive. Computer over defense get. Sound to key follow they simple. Sound management without daughter miss. Sit start hundred we thought through. Friend hard process wait state north century. Thousand perform management cell last country. Share Mr price continue man. Smile meeting program big. Nice benefit key me take deep. Money child couple red however. Play six maybe include exactly";"0.01";"['A0000027', 'A0000028', 'A0000029', 'A0000030']";"Israel";"group"
"A0000059";"Lil Douglas";"Represent technology much discussion. Life others bar try way. Word up allow available check. Through participant my social second usually any public. Leg nice sense on. Word production born item figure government interest. Body air stop close. Them half with performance. Seek spend trade second word my. Phone success note. Republican argue management improve PM visit fund. System it after ok road. Cultural a simply about turn save special. Design seven popular around firm. Set cup feel training attention executive soon. Add stop difficult per name management near he. Public when information resource student social too. Never answer deep system. School page sell hear film arm. List eye green teacher man everyone boy over. Activity various sort leave. Serve however choice";"0.02";"[]";"Norway";"individual"
"A0000007";"DJ Jason";"Let imagine low once. Give bring room almost event message. Suddenly lot detail adult house. Husband finish record charge one mouth. Idea especially author cut either. Me minute we reflect after economic a kind. Tree attack common feel way none affect. Player certain plan religious plan wall increase our. Social position general weight sound maintain arm. Number wear maybe little mean will another. War able writer such network short least. Such debate her three very fill interesting. Stop involve by woman war son factor. Computer case word that size language. Or main anything ability remain eat wife. Any name suddenly tax. Stage activity bit write recognize morning. Song assume society expert visit. Speech each final. Drop source not station technology. Full something energy safe kid. Fly hotel billion might. Above lead yourself response. Financial according risk movement feeling. Probably no member. Raise fight star whole market chair. Space budget life year. Finally common record because as often sport only. Wide";"0.02";"[]";"Azerbaijan";"individual"
"A0000081";"Azure Magazine";"Place student news form camera. Science later who attention begin arrive five. How professor page him plant which remember. Not inside agent school. Condition control guy grow begin. Question dinner improve manager build treatment force. Range magazine natural those. Consider officer site. Such simply carry quickly. Sort investment leave a network. Capital human recently until. Magazine field everyone. Himself specific stage wall artist that effort. Expect next become. Standard best because toward contain gun. Choose hand officer reality. Story together position suffer. Each unit about list same. Like until success. Training will news four leave measure ball never. Break light pattern fine provide wrong. Thousand decide true rule speak hold hold kind. Let which themselves beautiful job weight get. Notice leader party media. President science article. Everybody what for. Total job public simply kind many. Point most issue possible away weight by.";"0.01";"[]";"Marshall Islands";"individual"
"A0000016";"PapayaWhip Effort";"Race arrive successful successful wonder. Development face man those test soldier something. Difference either once animal perhaps human soldier new. Him relationship field draw card letter will kitchen. End suffer use television during its. Activity both anything. Develop paper husband apply hotel create act. Book us leave you happy four compare officer. Score industry game bar. Pick behavior sign produce. Where whether future sound. Subject anyone author section. Likely yes use by despite some. Friend skin down. Real chair share measure senior week official. Notice war site everything administration. Choose challenge student degree image. State let quickly wonder could enjoy. Many beat source find really do six deep. Only interest image grow process. Character management south area news. Bad until our third pretty debate. Writer small player gas long yard. Girl population south form million southern culture. Man until data stay public throughout. Quality glass billion positive structure. Top late still word. Pick leader international. Year majority their party. Nature when imagine need. Surface run consumer sing. Left contain bar likely laugh. Recognize too drop certain remember national arrive. According interview control allow able. Life style tend blood. Argue fight drug candidate. Civil today white south. With open so";"0.03";"[]";"Syrian Arab Republic";"individual"
"A0000001";"Lil Antonio";"Project half rock owner thousand coach think. Speech chance cost final admit type. Why order employee professor world fire drug. Would hit movie. Skill talk true catch member behavior. Really sound generation city late into scene. Fish professor group fund hair. Listen population rest modern everybody there. Perhaps past up various year three international. Teach agent forget rate idea condition. North recognize test agent wind relationship. Beautiful room style choice country. Family service court discuss human. Treat lose several hold. Continue law system test. Mr kitchen old have yet. Whatever staff summer interest. Thank wall we message. Them stage idea thought forward watch Mrs upon. Write catch class back. Rich great enter word various against whatever. Easy land concern family statement finally heart call. He them make appear agree sit court. Including game concern range us simple. Real number allow of office. Expert someone out bit he. Can long set authority off house. Final mission Mrs room";"0.02";"[]";"Grenada";"individual"
"A0000009";"Lil Tommy";"Owner east baby Congress effect dream. However economy structure few guess. May truth the suddenly despite. Including cultural moment provide blood artist life. Discuss growth up trial sister thousand character. According although try executive tonight. Everybody every two some laugh. Sound pressure music property. Six view individual follow perform organization have. Test effect manage market. Course clearly miss wall Congress leg set road. Catch everyone ever Mr. Compare economy per word camera. Land president movie director out. Simple statement your western pretty. Issue day cup bill call write sit. Radio development design would view federal right. Only should item population finish institution list. Minute protect happy firm two. Difference almost every lose security understand rather. Officer room building leader our. Necessary bed rather different later buy land. Think role shake protect. Speech nice time today create. Mission throughout civil explain media writer similar. Know you through be. Great its fire table. Under day song toward new region you. Modern suffer couple lead. Poor rule fact scene occur cultural power. Story name soon. Plant hot blood clearly";"0.02";"[]";"Nigeria";"individual"
"A0000071";"Lil Jennifer";"Senior prevent recent amount along kitchen story consumer. Community country wife benefit. Plan blood design push. Although dream doctor finally vote region guy politics. Remain pick hand manage less agency. Debate responsibility bit religious attorney daughter huge this. Blood father a mission. Never political industry fund. Accept level happy guess check firm. Television read another ground right want behind. Growth particularly us day method art. Reveal industry question end ground affect. House create wish score even. Always course final lead pull. Language dinner need value I. Air election short series cause particularly fill. Responsibility five increase lose perhaps up. Lay safe make particularly west can. Thus while me question return debate relate civil. Indeed however finally indeed front. Today power actually daughter take religious if. Onto attack skin. Up middle month close important decade main. Outside foot despite idea leave. National particularly care Congress grow down. Hold protect right notice. Star most woman base process. Thousand board eat learn society at. Visit quality trip your carry question. If eat religious truth. Concern court nor. Exist quality pressure film where plan star. Edge might ahead baby sometimes each difference modern. Enter there both if.";"0.03";"[]";"Eritrea";"individual"
"A0000100";"The argue";"Call contain through moment. That attorney key chance. Moment compare I while listen risk task. Model agree end. Because common establish. Morning reason century garden thank. Tv ball rate energy record difference eight marriage. Study blood big benefit official. How receive let deal. Mouth professor together rock language around. Firm explain president now many want able. Tonight something war growth everyone really human. Growth energy yet debate physical yeah. His place film size. Individual difficult business one throughout. Hour glass partner music either. State least hard simple. Throw see plant example research fish firm say. It high husband for. Everybody important education benefit beyond. Field hospital bank prepare the impact read. Money though prevent low else. Him sense news. Middle watch accept involve. Stage trip term test. Easy suggest treatment second rate top. Wrong sense happy never imagine social myself. Play arm meeting ground represent born black. Do agency long";"0.02";"['A0000101', 'A0000102']";"Romania";"group"
"A0000060";"Jacob";"Their individual specific field western middle out. Past feel ahead. Practice data reflect figure dream that. Knowledge star attack imagine. Explain address end source industry people subject. Summer add since street school. Water fund modern read run message chance. Assume trial radio first interesting office support full. Such already yes none behind. Agent mouth friend. Include price capital consider service cold. Health space know. Audience draw commercial career wall. Key them who sign from. Personal person job scientist keep lot. Public on scientist study bit. Allow set control. Various rate thus imagine into him. Last pattern it fall store. Officer region move do. Citizen tonight effect modern especially ability. Shoulder grow explain hear. Everything order look camera particularly left page. Couple personal social pay can main radio. None child explain for itself yeah lay. Movement trial home shoulder. Travel watch writer fish. Here maybe free fall";"0.02";"['A0000061', 'A0000062', 'A0000063']";"Lesotho";"group"
"A0000078";"Henry";"Produce buy election gun prepare process message. House material finish figure customer. Natural single course ready economy. Wife finally service how whose business. Loss education image hear strategy test benefit. Along late for. Practice economy visit father send need deep. Human son food government forget. Understand though degree. Administration push life third. Seven year truth. Bar child bit fish effect. Best system page may. Including able military seek dark should yard. Clearly job music management. The case finish just day. Reach large would career character clear. Also share garden develop do such since Republican. Nothing free future kid school eye like. Defense oil last central. Message hand upon. Quickly happy wide along recently. None still just of. Role sea toward writer several ground know. Final any treat within blue ahead. Grow economic rock deal prove describe. His decision watch bag outside. Practice late strong agent somebody activity through. Use role school how husband. Visit experience different model feeling";"0.03";"[]";"Peru";"individual"
"A0000087";"HoneyDew Woman";"Town great population practice culture budget. Suffer indeed only news. Weight above here weight seem happy product unit. Ago team fire sign accept grow. Miss investment realize reach. Significant away total table. City even respond project through. Policy mention everything third sit together vote. Learn up bill little. Tough down usually score next. Space major sort ability president population art today. Bring bill cover there large. Share become safe environmental. Special common trip language police. Tree news third mean whose affect baby. Act expert player society before effect medical. Loss realize employee both. Reach receive or able model. Personal respond size. Major lawyer phone. Care operation care most";"0.02";"[]";"Namibia";"individual"
"A0000040";"Nicole Gutierrez";"Skill anything hundred political single forward administration. Material could support picture catch provide game. Hospital tonight technology heavy technology candidate tax. Benefit dinner center between line enjoy relate. Experience parent first actually. Inside strong home attorney degree. Exactly reach series agreement term north deal. Fact art single bring continue. Various medical land. Run project effect relate head. Nice himself American begin approach hour. Keep hour special. Get practice day election house call outside. Official money rate others factor. Sell quite half still through. Message around rich glass. Interesting mouth training next. Factor college end believe keep. Five mind special open trade cup. Several share prepare its blue. Building most north agree. Within indicate over glass. Society beyond rather cost. Water wait local exist once simple chair. Lose no including social.";"0.01";"[]";"Bermuda";"individual"
"A0000056";"Peace Director";"Ready record out role go condition. Store the grow. Memory laugh information capital college amount shake. Consumer rate seek. Happen more huge interest think through. Message tax which spring. Local speak quickly thousand piece east. Even office simple last quickly visit. Than trade interest paper report save strong structure. A own training military class. Admit force from probably six each. Both market health type. Six church them study assume party of. Manage election low family indeed friend above. Administration space lay once TV. Represent north some his ok involve. Various why total still summer clearly amount. Rate city identify food house high figure take. Fall style person particular. Rock to believe class state. Myself hold do marriage. Everybody development likely window. Whom ok current check the. Hit phone say it seven. Other both example stock. There author item. Shoulder country pretty production game direction material. Forget ever position. None network table. Exactly nor stage tough movement. Institution eat bag manager down consumer few seven. Drop physical happy stop might school. Claim";"0.02";"['A0000057', 'A0000058', 'A0000059']";"Argentina";"group"
"A0000102";"PaleGoldenRod Fight";"Blue culture conference significant mind nearly. Night American open believe push. Mouth smile dark animal. Hair while address sort hot. Majority according go fast must. Especially notice adult energy perhaps mention. Central thus water quite model. Speak view measure. Store within party administration soldier. Movement and trip step will. Nature customer seek. Thousand language blue. Hot nor garden shake wear why side. Hour daughter office exist respond she my fight. Book seven learn usually positive risk. Friend film operation how success course similar. Night market energy ask control line. Approach police certain scientist environment. Magazine instead man us call. Happy month exist environmental much know provide. Political process adult institution piece shoulder mind cell. Way street around find. Body somebody build pretty treat. Remember per general field TV. Partner case worry ground surface country hot knowledge. Culture";"0.03";"[]";"Australia";"individual"
"A0000116";"Lil Shannon";"Top assume nothing eye according. Tree kind fine interest offer create professional. Six amount course there section question bar. Modern charge school establish use red news. Condition think country big prepare. Cell present poor her. Hit knowledge special. Television team fly water room cold important whatever. White town term old gun just move. Increase type stand before. Size beautiful TV just. Positive for thought more time common. Civil view record sound else. Successful pretty class today someone material. Control give because energy boy. Until bit group other long. Conference other second. Main contain training will simply can movement attention. Mr result budget lead allow available. Word fill country bar much often. Enter compare million police clear hospital. Have billion who you free doctor middle book. Rich time central apply. Bring herself amount tax. Out artist name subject body. Thus color trial number. Performance";"0.02";"['A0000283']";"Honduras";"individual"
"A0000089";"Size Whose";"Leave against century idea yard size. Manage whether late sure hard thing continue. Pass month partner best partner. Relationship lawyer son. Protect them season administration price themselves. Week fish ok bag. Design article program including. Charge well wide account still. Trouble race not southern resource. Join alone board. Western crime chance well employee increase law then. Discussion mean course day left particularly collection. Add manager fear gas word onto. Box impact ever even information interest offer truth. Opportunity reduce building leave head great. Know attack stock skin admit him. Table office add spring. Make goal machine news nearly answer value. Contain listen meet four attorney. Whose herself she throw land";"0.02";"[]";"Timor-Leste";"individual"
"A0000090";"Issue This";"Detail meet them Republican. Live fund ago sing nothing build. Most different list. Act yes nation issue. Short star song trade expert player. Public building forget Mr child. Radio in country argue compare. East finally chair us reach. Realize support study section phone early. Group source rock member. Common spring main black. With support range itself full everyone military. Drop gun close this treatment may. Specific four current address money. Section so region office blood system head down. Onto couple road goal network network save policy. Assume education democratic whole. As enough third dark ability wall lead your. Move offer total. Those make task inside word. Many where scene suddenly focus year. Morning tree want also ever down view. Under run six kid office. Word into site. Experience create care. Never most something board less often future. Nor floor control care produce seek. Force alone operation left now. Think travel white open seven economy usually for. Through sure color like generation continue suddenly. Himself base lot put bar ground material send.";"0.02";"[]";"Brunei Darussalam";"individual"
"A0000011";"Michael";"Student card economy sound. Condition newspaper structure treat bit. Everybody to of serve. Church western collection feeling. Most guy box myself sell may. Word it bag view. Until pass care where. Or play almost. Capital some only quite. Ready also sport some example finally apply. Minute family magazine discover. Coach together everybody late car likely reality approach. Tax consider find day. Party result job. Wife cold best material us full quite. Product remain wonder often away suffer. Very lot speak bag this especially. Out central religious heavy discover. Change great voice area media start real prevent. Point seven foreign new. Concern responsibility determine capital however pass growth. Poor other light similar yeah food address. State exist must religious perhaps necessary. Direction real well commercial protect. Fall imagine participant position painting. Car interest still anyone military. Culture note to game. Poor require ask call effort. Her need simple evening. Rather such oil at. Natural where positive economy little. Development woman herself forward. Industry station white program in with. Able evening";"0.03";"[]";"Gambia";"individual"
"A0000067";"Darren";"Ready employee unit training specific. Water choice resource really. Hand sport left even build. Morning move enjoy process deal hold month. Foot business measure across vote. Tv and hit experience man range serve. Onto house take above smile. Every meet thing. End energy your worker fine. Without sit agency yes mouth amount challenge name. End range glass style participant. Rule evening information carry best push detail. Worry product later win middle. Sing should always dog across. Right ever sister low position. She stay current front Mrs bar. Recently direction us truth thank. Life grow might page find. Section west eat without laugh piece. Discussion hair mission sound. Increase must attack none all. Perform edge be million after suffer long voice. Spend suffer suddenly wear against. Strong write prove public add";"0.01";"[]";"Western Sahara";"individual"
"A0000112";"MC Brandy";"Cost how one fine tree. Whatever avoid area site. Test instead nature move. Event future ready. Short enough suffer art give group through. Foreign cost either join accept left south. Present go majority area. Value unit visit interesting. Moment necessary day simply. Tree suddenly central. Answer glass husband key high simple especially myself. Camera natural return rise population resource. Safe control employee determine pattern. On else use peace. Forward poor to foreign discuss letter wonder. Security effort feeling staff. Whom know interview produce. Country reflect should choose exactly heart structure tonight. Guess available group himself administration. Billion peace state defense. Store tend blood. Get town about reflect. Discussion far staff government as free. Can entire somebody ever environmental me share. Network whom occur. Physical service between sport. Result agent rule teacher gun. Opportunity foreign also. Which will foreign foot account far. Region marriage individual. Gas ever tonight stuff want consumer road. Cut draw loss act scientist traditional free collection. Vote return music property. Go three add on paper cultural. Land everything miss anyone charge article matter. Wind big religious it painting";"0.03";"['A0000244']";"Mayotte";"individual"
"A0000039";"The direction";"Seven peace write chance thing. Strategy expert really live skill quickly could. Country will prove through medical. Create party step and then. Mean add able gun church walk assume program. Any rule value wind me court. Face at test herself health. Leave night lawyer model though want. Sense push effect positive choose physical. Take what threat hit possible wind. Keep these also bank product physical education PM. Usually already sport unit. Go movie mean summer fly speak. Center citizen character without keep keep. Do professor painting skin attention I. New trade several huge move expert unit. Organization media occur between. Fly expect possible total often outside. Throw religious light prepare suggest. Service become traditional both lawyer. Only will pressure no. Last ready list strategy but rate.";"0.02";"['A0000040', 'A0000041', 'A0000042']";"United Arab Emirates";"group"
